{
  "uncertainty": { "source_coverage_gap": "NOT_EVALUABLE" },
  "failure_conditions": [
    { "constraint_ref": "ORDER-02", "description": "Storage must never precede staging.", "id": "FC-01" }
  ],
  "evidence": [
    { "state": "storage", "accepted_authority": ["HUMAN_CONFIRMED", "AI_ASSISTED", "CONFIGURED", "DIRECT"] },
    { "state": "arrival", "accepted_authority": ["HUMAN_CONFIRMED", "CONFIGURED", "DIRECT"] },
    { "state": "clear", "accepted_authority": ["CONFIGURED", "DIRECT", "HUMAN_CONFIRMED"] },
    { "state": "departure", "accepted_authority": ["DIRECT", "HUMAN_CONFIRMED", "CONFIGURED"] },
    { "state": "staging", "required": true, "accepted_authority": ["AI_ASSISTED", "DIRECT", "HUMAN_CONFIRMED", "CONFIGURED"] }
  ],
  "constraints": [
    { "operator": "REQUIRED", "id": "REQ-01", "state": "arrival" },
    { "state": "staging", "operator": "REQUIRED", "id": "REQ-02" },
    { "id": "REQ-03", "operator": "REQUIRED", "state": "storage", "severity": "MANDATORY" },
    { "id": "REQ-04", "operator": "REQUIRED", "state": "departure" },
    { "id": "REQ-05", "operator": "REQUIRED", "state": "clear" },
    { "reference": "staging", "state": "arrival", "operator": "BEFORE", "id": "ORDER-01" },
    { "id": "ORDER-02", "operator": "BEFORE", "state": "staging", "reference": "storage", "description": "Staging must precede storage." },
    { "id": "ORDER-03", "operator": "BEFORE", "state": "storage", "reference": "departure" },
    { "id": "ORDER-04", "operator": "BEFORE", "state": "departure", "reference": "clear" },
    { "id": "TEMP-01", "operator": "WITHIN", "state": "staging", "after": "arrival", "duration": "PT420S" },
    { "id": "TEMP-02", "operator": "WITHIN", "state": "clear", "after": "departure", "duration": "PT0H15M" }
  ],
  "states": [
    { "zone": "receiving-entry", "required": true, "name": "Arrival", "id": "arrival" },
    { "id": "staging", "name": "Staging", "required": true, "zone": "staging", "terminal": false },
    { "id": "storage", "name": "Storage", "required": true, "zone": "storage-transition" },
    { "id": "departure", "name": "Departure", "required": true, "zone": "receiving-exit" },
    { "id": "clear", "name": "Clear", "required": true, "terminal": true, "zone": "receiving-exit" }
  ],
  "zones": [
    { "name": "Storage Transition", "id": "storage-transition" },
    { "id": "staging", "name": "Staging Area" },
    { "id": "receiving-exit", "name": "Receiving Exit" },
    { "id": "receiving-entry", "name": "Receiving Entry" }
  ],
  "metadata": {
    "profile": "linear-verification",
    "domain": "logistics",
    "created_at": "2026-10-18",
    "authors": ["SEQSEAL"],
    "description": "Verifies the required sequence for an inbound receiving workflow."
  },
  "protocol": {
    "name": "Inbound Delivery Integrity",
    "version": "1.0.0",
    "id": "IDP-01",
    "description": "Verifies the ordered physical execution of an inbound delivery: arrival, staging, storage, departure and return to a clear dock.\n"
  },
  "pwps": "0.1"
}
